{
  "schema_version": 1,
  "id": "EVID.EXPERIMENTAL.OPS.INTAKE.SOURCE_ENRICHED_TRIAGE.02",
  "status": "active",
  "source": {
    "type": "manual_decision",
    "locator": "UIGS operationalization discussion 2026-10-02",
    "revision": null,
    "environment_fingerprint": "OPS.INTAKE.SOURCE_ENRICHED_TRIAGE"
  },
  "observed_at": "2026-10-07T00:00:00+00:00",
  "valid_until": null,
  "independence_key": "LEGACY.EXPERIMENTAL.OPS.INTAKE.SOURCE_ENRICHED_TRIAGE.11576865_UIGS-Foundry",
  "provenance": {
    "entity_id": "legacy-experimental:OPS.INTAKE.SOURCE_ENRICHED_TRIAGE:2",
    "activity_id": "experimental-claim-coverage-2026-10-07",
    "agent_id": "UIGS-Foundry",
    "was_derived_from": [],
    "was_attributed_to": "manual_decision"
  },
  "relations": [
    {
      "claim_id": "CLAIM.OPS.INTAKE.SOURCE_ENRICHED_TRIAGE",
      "result": "supports",
      "defeater_type": "none",
      "directness": "runtime",
      "scope_relation": "within_scope",
      "assumption_context": [],
      "notes": "explicit implementation authorization"
    }
  ]
}
