{
  "schema_version": 1,
  "id": "EVID.EXPERIMENTAL.OPS.UIGS.SOURCE_OWNED_UI_INVENTORY.01",
  "status": "active",
  "source": {
    "type": "repository",
    "locator": "11576865/ASS-Workbench-Android:.uigs/ui-surfaces.json",
    "revision": "818a26d2024f1b27a947d147b2f1de0142ce482d",
    "environment_fingerprint": "OPS.UIGS.SOURCE_OWNED_UI_INVENTORY"
  },
  "observed_at": "2026-10-07T00:00:00+00:00",
  "valid_until": null,
  "independence_key": "LEGACY.EXPERIMENTAL.OPS.UIGS.SOURCE_OWNED_UI_INVENTORY.11576865_ASS-Workbench-Android",
  "provenance": {
    "entity_id": "legacy-experimental:OPS.UIGS.SOURCE_OWNED_UI_INVENTORY:1",
    "activity_id": "experimental-claim-coverage-2026-10-07",
    "agent_id": "UIGS-Foundry",
    "was_derived_from": [],
    "was_attributed_to": "repository"
  },
  "relations": [
    {
      "claim_id": "CLAIM.OPS.UIGS.SOURCE_OWNED_UI_INVENTORY",
      "result": "supports",
      "defeater_type": "none",
      "directness": "static",
      "scope_relation": "within_scope",
      "assumption_context": [],
      "notes": "source-owned UI inventory"
    }
  ]
}
