{
  "schema_version": 1,
  "id": "EVID.EXPERIMENTAL.TEST.DESTRUCTIVE_COMBINATION_MATRIX.01",
  "status": "active",
  "source": {
    "type": "file",
    "locator": "11576865/ASS-Workbench-Android:docs/HARDENING-0.27.md",
    "revision": "def359517071d620f41de1320656b7e48aa28b98",
    "environment_fingerprint": "TEST.DESTRUCTIVE_COMBINATION_MATRIX"
  },
  "observed_at": "2026-10-07T00:00:00+00:00",
  "valid_until": null,
  "independence_key": "LEGACY.EXPERIMENTAL.TEST.DESTRUCTIVE_COMBINATION_MATRIX.11576865_ASS-Workbench-Android",
  "provenance": {
    "entity_id": "legacy-experimental:TEST.DESTRUCTIVE_COMBINATION_MATRIX:1",
    "activity_id": "experimental-claim-coverage-2026-10-07",
    "agent_id": "UIGS-Foundry",
    "was_derived_from": [],
    "was_attributed_to": "file"
  },
  "relations": [
    {
      "claim_id": "CLAIM.TEST.DESTRUCTIVE_COMBINATION_MATRIX",
      "result": "supports",
      "defeater_type": "none",
      "directness": "runtime",
      "scope_relation": "within_scope",
      "assumption_context": [],
      "notes": "implemented release hardening matrix"
    }
  ]
}
