{
  "schema_version": 1,
  "id": "EVID.EXPERIMENTAL.ARCH.DECLARED_DISCOVERED_RECONCILIATION.01",
  "status": "active",
  "source": {
    "type": "file",
    "locator": "11576865/Character-Voice-Service:server/reconciliation.py",
    "revision": "248e8a7dd4755af378fe4dbe68fbddedefd21203",
    "environment_fingerprint": "ARCH.DECLARED_DISCOVERED_RECONCILIATION"
  },
  "observed_at": "2026-10-07T00:00:00+00:00",
  "valid_until": null,
  "independence_key": "LEGACY.EXPERIMENTAL.ARCH.DECLARED_DISCOVERED_RECONCILIATION.11576865_Character-Voice-Service",
  "provenance": {
    "entity_id": "legacy-experimental:ARCH.DECLARED_DISCOVERED_RECONCILIATION:1",
    "activity_id": "experimental-claim-coverage-2026-10-07",
    "agent_id": "UIGS-Foundry",
    "was_derived_from": [],
    "was_attributed_to": "file"
  },
  "relations": [
    {
      "claim_id": "CLAIM.ARCH.DECLARED_DISCOVERED_RECONCILIATION",
      "result": "supports",
      "defeater_type": "none",
      "directness": "runtime",
      "scope_relation": "within_scope",
      "assumption_context": [],
      "notes": "production implementation"
    }
  ]
}
