{
  "schema_version": 1,
  "id": "EVID.EXPERIMENTAL.REL.PROVENANCE.PATH_CONTENT_CURRENTNESS.01",
  "status": "active",
  "source": {
    "type": "repository",
    "locator": "11576865/ASS-Workbench-Android",
    "revision": "818a26d2024f1b27a947d147b2f1de0142ce482d",
    "environment_fingerprint": "REL.PROVENANCE.PATH_CONTENT_CURRENTNESS"
  },
  "observed_at": "2026-10-07T00:00:00+00:00",
  "valid_until": null,
  "independence_key": "LEGACY.EXPERIMENTAL.REL.PROVENANCE.PATH_CONTENT_CURRENTNESS.11576865_ASS-Workbench-Android",
  "provenance": {
    "entity_id": "legacy-experimental:REL.PROVENANCE.PATH_CONTENT_CURRENTNESS:1",
    "activity_id": "experimental-claim-coverage-2026-10-07",
    "agent_id": "UIGS-Foundry",
    "was_derived_from": [],
    "was_attributed_to": "repository"
  },
  "relations": [
    {
      "claim_id": "CLAIM.REL.PROVENANCE.PATH_CONTENT_CURRENTNESS",
      "result": "supports",
      "defeater_type": "none",
      "directness": "runtime",
      "scope_relation": "within_scope",
      "assumption_context": [],
      "notes": "metadata-only UI inventory commit advanced HEAD while registered implementation files were unchanged"
    }
  ]
}
