{
  "schema_version": 1,
  "id": "EVID.PREVENT.DESTRUCTIVE_OPTIONAL_INPUT_TRI_STATE.G1.ENFORCEMENT.PR95",
  "status": "active",
  "source": {
    "type": "pull_request",
    "locator": "11576865/ASS-Workbench-Android#95",
    "revision": null,
    "environment_fingerprint": "prevention-generation-1"
  },
  "observed_at": "2026-10-07T00:00:00+00:00",
  "valid_until": null,
  "independence_key": "PREVENTION.CLAIM.PREVENT.DESTRUCTIVE_OPTIONAL_INPUT_TRI_STATE.G1.PR95",
  "provenance": {
    "entity_id": "ASS-Workbench-Android#95",
    "activity_id": "prevention-enforcement",
    "agent_id": "11576865/ASS-Workbench-Android",
    "was_derived_from": [],
    "was_attributed_to": "11576865/ASS-Workbench-Android"
  },
  "relations": [
    {
      "claim_id": "CLAIM.PREVENT.DESTRUCTIVE_OPTIONAL_INPUT_TRI_STATE.G1",
      "result": "supports",
      "defeater_type": "none",
      "directness": "static",
      "scope_relation": "within_scope",
      "assumption_context": [
        "CLAIM.PREVENT.DESTRUCTIVE_OPTIONAL_INPUT_TRI_STATE.G1.ASSUMPTION.GENERATION"
      ],
      "notes": "PR #95 introduced the first Batch/form three-state controls and regression coverage."
    }
  ]
}
