{
  "schema_version": 1,
  "id": "EVID.UIGS.ANDROID_CAPTURE.DECLARED_ORIENTATION_NOT_ENFORCED.03",
  "status": "active",
  "source": {
    "type": "workflow_run",
    "locator": "UIGS-Foundry GitHub Actions Capture Production UI Android run 36994316528",
    "revision": "01cec249664611cc69f4728ca641964296549d1a",
    "environment_fingerprint": "BUG.UIGS.ANDROID_CAPTURE.DECLARED_ORIENTATION_NOT_ENFORCED"
  },
  "observed_at": "2026-10-07T00:00:00+00:00",
  "valid_until": null,
  "independence_key": "LEGACY.BUG.UIGS.ANDROID_CAPTURE.DECLARED_ORIENTATION_NOT_ENFORCED.INCIDENT",
  "provenance": {
    "entity_id": "legacy:BUG.UIGS.ANDROID_CAPTURE.DECLARED_ORIENTATION_NOT_ENFORCED:3",
    "activity_id": "validated-legacy-migration-2026-10-07",
    "agent_id": "UIGS-Foundry",
    "was_derived_from": [],
    "was_attributed_to": "report"
  },
  "relations": [
    {
      "claim_id": "CLAIM.UIGS.ANDROID_CAPTURE.DECLARED_ORIENTATION_NOT_ENFORCED",
      "result": "supports",
      "defeater_type": "none",
      "directness": "real_sample",
      "scope_relation": "within_scope",
      "assumption_context": [],
      "notes": "successful corrected emulator/compositor capture at 1600x1000"
    }
  ]
}
