{
  "schema_version": 1,
  "id": "EVID.EXPERIMENTAL.UIGS.COMPOSITION.PREVIEW_INSPECTOR_SPLIT.03",
  "status": "active",
  "source": {
    "type": "file",
    "locator": "11576865/HSR-Voice-Archive-Builder:tests/test_progress_ui.py",
    "revision": "7374fb8871908b13de90b21ebbb4d050c92bcc59",
    "environment_fingerprint": "UIGS.COMPOSITION.PREVIEW_INSPECTOR_SPLIT"
  },
  "observed_at": "2026-10-07T00:00:00+00:00",
  "valid_until": null,
  "independence_key": "LEGACY.EXPERIMENTAL.UIGS.COMPOSITION.PREVIEW_INSPECTOR_SPLIT.11576865_HSR-Voice-Archive-Builder",
  "provenance": {
    "entity_id": "legacy-experimental:UIGS.COMPOSITION.PREVIEW_INSPECTOR_SPLIT:3",
    "activity_id": "experimental-claim-coverage-2026-10-07",
    "agent_id": "UIGS-Foundry",
    "was_derived_from": [],
    "was_attributed_to": "file"
  },
  "relations": [
    {
      "claim_id": "CLAIM.UIGS.COMPOSITION.PREVIEW_INSPECTOR_SPLIT",
      "result": "supports",
      "defeater_type": "none",
      "directness": "runtime",
      "scope_relation": "within_scope",
      "assumption_context": [],
      "notes": "UI contract tests"
    }
  ]
}
