{
  "schema_version": 1,
  "id": "EVID.EXPERIMENTAL.REL.VERIFY_THEN_PUBLISH.02",
  "status": "active",
  "source": {
    "type": "repository",
    "locator": "11576865/Quick-Automatic-Hardsub-Encoder",
    "revision": "3300811cce41f828055bce1272dbd9c0eb9d3d48",
    "environment_fingerprint": "REL.VERIFY_THEN_PUBLISH"
  },
  "observed_at": "2026-10-07T00:00:00+00:00",
  "valid_until": null,
  "independence_key": "LEGACY.EXPERIMENTAL.REL.VERIFY_THEN_PUBLISH.11576865_Quick-Automatic-Hardsub-Encoder",
  "provenance": {
    "entity_id": "legacy-experimental:REL.VERIFY_THEN_PUBLISH:2",
    "activity_id": "experimental-claim-coverage-2026-10-07",
    "agent_id": "UIGS-Foundry",
    "was_derived_from": [],
    "was_attributed_to": "repository"
  },
  "relations": [
    {
      "claim_id": "CLAIM.REL.VERIFY_THEN_PUBLISH",
      "result": "supports",
      "defeater_type": "none",
      "directness": "runtime",
      "scope_relation": "within_scope",
      "assumption_context": [],
      "notes": "workflow smoke coverage; Windows local smoke exercises verified-output rejection paths."
    }
  ]
}
