{
  "schema_version": 1,
  "id": "EVID.EXPERIMENTAL.UIGS.WORKSPACE.EXPLICIT_TOOL_BINDING.01",
  "status": "active",
  "source": {
    "type": "file",
    "locator": "11576865/ASS-Workbench-Android:docs/WORKSPACE_MIGRATION_CHECKLIST.md",
    "revision": "c10980aea79e75f72fe482e759393a400973a64b",
    "environment_fingerprint": "UIGS.WORKSPACE.EXPLICIT_TOOL_BINDING"
  },
  "observed_at": "2026-10-07T00:00:00+00:00",
  "valid_until": null,
  "independence_key": "LEGACY.EXPERIMENTAL.UIGS.WORKSPACE.EXPLICIT_TOOL_BINDING.11576865_ASS-Workbench-Android",
  "provenance": {
    "entity_id": "legacy-experimental:UIGS.WORKSPACE.EXPLICIT_TOOL_BINDING:1",
    "activity_id": "experimental-claim-coverage-2026-10-07",
    "agent_id": "UIGS-Foundry",
    "was_derived_from": [],
    "was_attributed_to": "file"
  },
  "relations": [
    {
      "claim_id": "CLAIM.UIGS.WORKSPACE.EXPLICIT_TOOL_BINDING",
      "result": "supports",
      "defeater_type": "none",
      "directness": "runtime",
      "scope_relation": "within_scope",
      "assumption_context": [],
      "notes": "implemented migration + open remainder"
    }
  ]
}
